{"componentChunkName":"component---src-components-layout-tsx","path":"/fr","result":{"data":{"mdx":{"id":"62404e44-e998-51be-a64c-0c333719b041","body":"function _extends() { _extends = Object.assign || function (target) { for (var i = 1; i < arguments.length; i++) { var source = arguments[i]; for (var key in source) { if (Object.prototype.hasOwnProperty.call(source, key)) { target[key] = source[key]; } } } return target; }; return _extends.apply(this, arguments); }\n\nfunction _objectWithoutProperties(source, excluded) { if (source == null) return {}; var target = _objectWithoutPropertiesLoose(source, excluded); var key, i; if (Object.getOwnPropertySymbols) { var sourceSymbolKeys = Object.getOwnPropertySymbols(source); for (i = 0; i < sourceSymbolKeys.length; i++) { key = sourceSymbolKeys[i]; if (excluded.indexOf(key) >= 0) continue; if (!Object.prototype.propertyIsEnumerable.call(source, key)) continue; target[key] = source[key]; } } return target; }\n\nfunction _objectWithoutPropertiesLoose(source, excluded) { if (source == null) return {}; var target = {}; var sourceKeys = Object.keys(source); var key, i; for (i = 0; i < sourceKeys.length; i++) { key = sourceKeys[i]; if (excluded.indexOf(key) >= 0) continue; target[key] = source[key]; } return target; }\n\n/* @jsxRuntime classic */\n\n/* @jsx mdx */\nvar _frontmatter = {\n  \"metadata\": {\n    \"title\": \"Internet a besoin de super-h√©ros.\",\n    \"description\": \"Exorde rassemble les personnes qui combattent la d√©sinformation en ligne.\",\n    \"image\": \"../images/hero.png\",\n    \"canonical\": true\n  },\n  \"hero\": {\n    \"title\": \"Internet a besoin de super-h√©ros.\",\n    \"description\": \"Exorde rassemble les personnes qui combattent la d√©sinformation en ligne.\",\n    \"whitepaperButton\": \"Livre blanc\",\n    \"waitlistButton\": \"Me tenir inform√©\"\n  },\n  \"video\": {\n    \"url\": \"https://www.youtube-nocookie.com/embed/cSKGa_7XJkg?controls=0&hl=fr&cc_lang_pref=fr&cc_load_policy=1&autoplay=1\",\n    \"thumbnail\": \"https://i.ytimg.com/vi_webp/cSKGa_7XJkg/maxresdefault.webp\",\n    \"title\": \"Notre ennemi ? La propagation de fausses informations.\",\n    \"description\": \"Aujourd'hui, lorsque n'importe quel type de contenu (image, article, vid√©o, audio, ...) est diffus√© sur le web, il peut se r√©pandre partout en quelques secondes, sans contexte et dans n'importe quel but. Tout contenu authentique (ou non) peut √™tre r√©utilis√© pour cr√©er une fausse information virale, afin de manipuler l'opinion publique sur un sujet donn√© √† court terme ou nuire √† la r√©putation de toute entit√© (organisations, personnalit√©s, etc.).\"\n  },\n  \"showcase\": {\n    \"title\": \"Pr√©parez-vous, Exorde arrive.\",\n    \"products\": [{\n      \"title\": \"Le bouclier\",\n      \"description\": \"Une extension de navigateur gratuite et open-source qui affichera un indicateur de fiabilit√© pour chaque information que vous rencontrerez sur internet.\",\n      \"image\": \"../images/shield.svg\"\n    }, {\n      \"title\": \"Le pouvoir\",\n      \"description\": \"Une plateforme collaborative gratuite et open-source, dans laquelle vous r√©alisez diverses t√¢ches et en √©tant r√©compens√© pour votre contribution.\",\n      \"image\": \"../images/thunderbolt.svg\"\n    }]\n  },\n  \"concept\": {\n    \"title\": \"Comprendre Exorde en une minute.\",\n    \"steps\": [{\n      \"description\": \"Il est difficile, lorsque l'on navigue sur internet, de savoir si ce que nous lisons est fiable. Exorde a pour but de vous aider √† naviguer sereinement.\",\n      \"image\": \"../images/exorde-context.svg\"\n    }, {\n      \"description\": \"La plateforme Exorde rassemblera toute une communaut√© qui parcourra le web et ses informations. Accessible gratuitement par tous √† travers un site web, il vous suffira de cr√©er un compte pour y acc√©der. Vous aurez alors diff√©rentes t√¢ches √† r√©aliser pour trouver, classer et lier les informations du web et permettre au syst√®me Exorde de d√©tecter les fake news.\",\n      \"image\": \"../images/exorde-platform.svg\"\n    }, {\n      \"description\": \"Pour chaque contribution et lorsqu'il y aura consensus entre les diff√©rents collaborateurs, vous gagnerez de l'EXD, la crypto-monnaie d'Exorde. Vous pourrez ensuite l'√©changer contre des euros, dollars, ethereum, bitcoin, etc.\",\n      \"image\": \"../images/exorde-money.svg\"\n    }, {\n      \"description\": \"Les informations entr√©es sur la plateforme se retrouveront ensuite sur l'extension de navigateur Exorde. Accessible sans inscription, cette extension vous permettra d'afficher un indicateur de fiabilit√© sur la page que vous visitez et vous indiquera les autres sites contenant des informations similaires.\",\n      \"image\": \"../images/exorde-extension.svg\"\n    }]\n  },\n  \"whitepaper\": {\n    \"title\": \"Livre blanc\",\n    \"description\": \"Exorde √©tant un syst√®me complexe, nous ne pouvions que l'aborder de fa√ßon macroscopique sur ce site web. Ce livre blanc, fruit de longues r√©flexions au sein de notre √©quipe, est donc √† destination des plus curieux. Vous y trouverez les explications d√©taill√©s de ce qu'est Exorde et comment, avec vous, nous allons changer le web.\",\n    \"file\": \"../pdf/whitepaper.pdf\",\n    \"pdfButton\": {\n      \"label\": \"Format pdf\"\n    }\n  },\n  \"newsletter\": {\n    \"title\": \"Newsletter\",\n    \"description\": \"Vous voulez suivre l'avanc√©e du projet Exorde ? Entrez votre pr√©nom, votre mail et c'est parti pour l'aventure üöÄ.\",\n    \"form\": {\n      \"firstNameLabel\": \"Pr√©nom\",\n      \"emailLabel\": \"Email\",\n      \"buttonLabel\": \"Souscrire\",\n      \"successLabel\": \"Envoy√©\",\n      \"successMessage\": \"Merci pour votre souscription ! Vous allez recevoir un email de notre part pour confirmer votre adresse, veuillez v√©rifier vos spams si celui-ci n'appara√Æt pas dans votre boite de r√©ception.\"\n    }\n  }\n};\nvar layoutProps = {\n  _frontmatter: _frontmatter\n};\nvar MDXLayout = \"wrapper\";\nreturn function MDXContent(_ref) {\n  var components = _ref.components,\n      props = _objectWithoutProperties(_ref, [\"components\"]);\n\n  return mdx(MDXLayout, _extends({}, layoutProps, props, {\n    components: components,\n    mdxType: \"MDXLayout\"\n  }), mdx(Hero, {\n    content: props.frontmatter.hero,\n    mdxType: \"Hero\"\n  }), mdx(Enemy, {\n    content: props.frontmatter.video,\n    mdxType: \"Enemy\"\n  }), mdx(Concept, {\n    title: props.frontmatter.concept.title,\n    steps: props.frontmatter.concept.steps,\n    mdxType: \"Concept\"\n  }), mdx(Products, {\n    title: props.frontmatter.showcase.title,\n    products: props.frontmatter.showcase.products,\n    mdxType: \"Products\"\n  }), mdx(Whitepaper, {\n    title: props.frontmatter.whitepaper.title,\n    description: props.frontmatter.whitepaper.description,\n    file: props.frontmatter.whitepaper.file,\n    pdfButton: props.frontmatter.whitepaper.pdfButton,\n    mdxType: \"Whitepaper\"\n  }), mdx(Newsletter, {\n    title: props.frontmatter.newsletter.title,\n    description: props.frontmatter.newsletter.description,\n    form: props.frontmatter.newsletter.form,\n    locale: props.locale,\n    mdxType: \"Newsletter\"\n  }));\n}\n;\nMDXContent.isMDXComponent = true;","frontmatter":{"noindex":null,"metadata":{"title":"Internet a besoin de super-h√©ros.","description":"Exorde rassemble les personnes qui combattent la d√©sinformation en ligne.","image":{"publicURL":"/static/5d7f8034e7605e31ce38010f8e498085/hero.png"},"canonical":true},"hero":{"title":"Internet a besoin de super-h√©ros.","description":"Exorde rassemble les personnes qui combattent la d√©sinformation en ligne.","whitepaperButton":"Livre blanc","waitlistButton":"Me tenir inform√©"},"video":{"title":"Notre ennemi ? La propagation de fausses informations.","description":"Aujourd'hui, lorsque n'importe quel type de contenu (image, article, vid√©o, audio, ...) est diffus√© sur le web, il peut se r√©pandre partout en quelques secondes, sans contexte et dans n'importe quel but. Tout contenu authentique (ou non) peut √™tre r√©utilis√© pour cr√©er une fausse information virale, afin de manipuler l'opinion publique sur un sujet donn√© √† court terme ou nuire √† la r√©putation de toute entit√© (organisations, personnalit√©s, etc.).","url":"https://www.youtube-nocookie.com/embed/cSKGa_7XJkg?controls=0&hl=fr&cc_lang_pref=fr&cc_load_policy=1&autoplay=1","thumbnail":"https://i.ytimg.com/vi_webp/cSKGa_7XJkg/maxresdefault.webp"},"showcase":{"title":"Pr√©parez-vous, Exorde arrive.","products":[{"title":"Le bouclier","description":"Une extension de navigateur gratuite et open-source qui affichera un indicateur de fiabilit√© pour chaque information que vous rencontrerez sur internet.","image":{"publicURL":"/static/f95a2e57386be32ae10f459cee7dd0df/shield.svg"}},{"title":"Le pouvoir","description":"Une plateforme collaborative gratuite et open-source, dans laquelle vous r√©alisez diverses t√¢ches et en √©tant r√©compens√© pour votre contribution.","image":{"publicURL":"/static/9dd4f09accbbb6bf80598ce1279977c8/thunderbolt.svg"}}]},"concept":{"title":"Comprendre Exorde en une minute.","steps":[{"description":"Il est difficile, lorsque l'on navigue sur internet, de savoir si ce que nous lisons est fiable. Exorde a pour but de vous aider √† naviguer sereinement.","image":{"publicURL":"/static/2f5225f1ecf2ddf8d73bb7c22337de56/exorde-context.svg","name":"exorde-context"}},{"description":"La plateforme Exorde rassemblera toute une communaut√© qui parcourra le web et ses informations. Accessible gratuitement par tous √† travers un site web, il vous suffira de cr√©er un compte pour y acc√©der. Vous aurez alors diff√©rentes t√¢ches √† r√©aliser pour trouver, classer et lier les informations du web et permettre au syst√®me Exorde de d√©tecter les fake news.","image":{"publicURL":"/static/e4433ba86e5eaed0975a3806b243ddd2/exorde-platform.svg","name":"exorde-platform"}},{"description":"Pour chaque contribution et lorsqu'il y aura consensus entre les diff√©rents collaborateurs, vous gagnerez de l'EXD, la crypto-monnaie d'Exorde. Vous pourrez ensuite l'√©changer contre des euros, dollars, ethereum, bitcoin, etc.","image":{"publicURL":"/static/8307cbac64566b8303b8ce0cf6e5e7f1/exorde-money.svg","name":"exorde-money"}},{"description":"Les informations entr√©es sur la plateforme se retrouveront ensuite sur l'extension de navigateur Exorde. Accessible sans inscription, cette extension vous permettra d'afficher un indicateur de fiabilit√© sur la page que vous visitez et vous indiquera les autres sites contenant des informations similaires.","image":{"publicURL":"/static/1ea828e927e5cda99241dfe891e6bb0f/exorde-extension.svg","name":"exorde-extension"}}]},"whitepaper":{"title":"Livre blanc","description":"Exorde √©tant un syst√®me complexe, nous ne pouvions que l'aborder de fa√ßon macroscopique sur ce site web. Ce livre blanc, fruit de longues r√©flexions au sein de notre √©quipe, est donc √† destination des plus curieux. Vous y trouverez les explications d√©taill√©s de ce qu'est Exorde et comment, avec vous, nous allons changer le web.","file":{"publicURL":"/static/76aaa000ae9d652a192fd6d843215227/whitepaper.pdf"},"pdfButton":{"label":"Format pdf"}},"newsletter":{"title":"Newsletter","description":"Vous voulez suivre l'avanc√©e du projet Exorde ? Entrez votre pr√©nom, votre mail et c'est parti pour l'aventure üöÄ.","form":{"firstNameLabel":"Pr√©nom","emailLabel":"Email","buttonLabel":"Souscrire","successLabel":"Envoy√©","successMessage":"Merci pour votre souscription ! Vous allez recevoir un email de notre part pour confirmer votre adresse, veuillez v√©rifier vos spams si celui-ci n'appara√Æt pas dans votre boite de r√©ception."},"success":null}}}},"pageContext":{"id":"62404e44-e998-51be-a64c-0c333719b041","locale":"fr","alternatePages":[{"slug":"/","locale":"en"},{"slug":"/fr","locale":"fr"}]}},"staticQueryHashes":["3897982121"]}