{"componentChunkName":"component---src-components-layout-tsx","path":"/","result":{"data":{"mdx":{"id":"63bbc44f-caf4-532a-b433-11c38f40d022","body":"function _extends() { _extends = Object.assign || function (target) { for (var i = 1; i < arguments.length; i++) { var source = arguments[i]; for (var key in source) { if (Object.prototype.hasOwnProperty.call(source, key)) { target[key] = source[key]; } } } return target; }; return _extends.apply(this, arguments); }\n\nfunction _objectWithoutProperties(source, excluded) { if (source == null) return {}; var target = _objectWithoutPropertiesLoose(source, excluded); var key, i; if (Object.getOwnPropertySymbols) { var sourceSymbolKeys = Object.getOwnPropertySymbols(source); for (i = 0; i < sourceSymbolKeys.length; i++) { key = sourceSymbolKeys[i]; if (excluded.indexOf(key) >= 0) continue; if (!Object.prototype.propertyIsEnumerable.call(source, key)) continue; target[key] = source[key]; } } return target; }\n\nfunction _objectWithoutPropertiesLoose(source, excluded) { if (source == null) return {}; var target = {}; var sourceKeys = Object.keys(source); var key, i; for (i = 0; i < sourceKeys.length; i++) { key = sourceKeys[i]; if (excluded.indexOf(key) >= 0) continue; target[key] = source[key]; } return target; }\n\n/* @jsxRuntime classic */\n\n/* @jsx mdx */\nvar data = {\n  hero: {\n    title: 'The Internet needs superheroes.',\n    description: 'Exorde is the place where people fight against online misinformation.',\n    whitepaperButton: 'Whitepaper',\n    waitlistButton: 'Suscribe'\n  },\n  video: {\n    url: 'https://www.youtube-nocookie.com/embed/cSKGa_7XJkg?controls=0&autoplay=1',\n    thumbnail: 'https://i.ytimg.com/vi_webp/cSKGa_7XJkg/maxresdefault.webp',\n    title: 'Our enemy ? Fake news propagation.'\n  },\n  showcase: {\n    title: 'Brace yourselves, Exorde is coming.',\n    products: [{\n      title: 'Exorde shield',\n      description: 'A free open-source browser extension that displays a trust score for every information you encounter on the Internet.',\n      image: '../images/shield.svg'\n    }, {\n      title: 'Exorde power',\n      description: 'A free open-source collaborative platform where you do some tasks, and you receive payment in exchange for your efforts.',\n      image: '../images/thunderbolt.svg'\n    }]\n  },\n  concept: {\n    title: 'Understand Exorde in a minute.',\n    steps: [{\n      description: \"It's difficult, when surfing the internet, to know if what we read is reliable. Exorde aims to help you navigate serenely.\",\n      image: '../images/exorde-context.svg'\n    }, {\n      description: 'The Exorde platform will gather a whole community that will browse the web and its information. Accessible for free by everyone through a website, you will just have to create an account to access it. You will then have different tasks to perform to find, classify and link information on the web and allow the Exorde system to detect fake news.',\n      image: '../images/exorde-platform.svg'\n    }, {\n      description: 'For each contribution and when there is a consensus between the different collaborators, you will earn EXD, the cryptocurrency of Exorde. You will then be able to exchange it for euros, dollars, ethereum, bitcoin, etc.',\n      image: '../images/exorde-money.svg'\n    }, {\n      description: 'The information entered on the platform will then be found on APIs dedicated to developers and on the Exorde browser extension. Accessible without registration, this extension will allow you to display a reliability indicator on the page you visit and will indicate other sites that contain similar information.',\n      image: '../images/exorde-extension.svg'\n    }]\n  },\n  whitepaper: {\n    title: 'Whitepaper',\n    description: 'Exorde is a complex system, so we could only approach it in a macroscopic way on this website. This whitepaper, result of long reflections within our team, is therefore intended for the most curious. You will find detailed explanations of what Exorde is and how, with your help, we will change the internet.',\n    file: '../pdf/whitepaper.pdf',\n    pdfButton: {\n      label: 'Pdf version'\n    }\n  },\n  newsletter: {\n    title: 'Newsletter',\n    description: \"Do you want to follow the progress of the Exorde project? Enter your first name, your email and let's go ðŸš€.\",\n    form: {\n      firstNameLabel: 'First name',\n      emailLabel: 'Email',\n      buttonLabel: 'Suscribe',\n      successLabel: 'Sent',\n      successMessage: 'Thanks for your subscription ! You will receive an email from us to confirm your address, please check your spam if it does not appear in your inbox.'\n    }\n  }\n};\nvar _frontmatter = {\n  \"metadata\": {\n    \"title\": \"The Internet needs superheroes.\",\n    \"description\": \"Exorde is the place where people fight against online misinformation.\",\n    \"image\": \"../images/hero.png\",\n    \"canonical\": true\n  },\n  \"hero\": {\n    \"title\": \"The Internet needs superheroes.\",\n    \"description\": \"Exorde is the place where people fight against online misinformation.\",\n    \"whitepaperButton\": \"Whitepaper\",\n    \"waitlistButton\": \"Suscribe\"\n  },\n  \"video\": {\n    \"url\": \"https://www.youtube-nocookie.com/embed/cSKGa_7XJkg?controls=0&autoplay=1\",\n    \"thumbnail\": \"https://i.ytimg.com/vi_webp/cSKGa_7XJkg/maxresdefault.webp\",\n    \"title\": \"Our enemy ? Fake news propagation.\",\n    \"description\": \"In recent years, a great deal of attention has been devoted to the rise in fake news: everything from satire and misleading content to articles that are completely fabricated. When any type of content (image, news, video, audio, â€¦) makes it on the web, it can spread anywhere in a matter of seconds, without any original context, for any purpose. Any authentic content (or not) can be reused to create viral fake information to manipulate the public opinion on a given subject in the short term or hurt the reputation of any entity (organizations, personas, etc).\"\n  },\n  \"showcase\": {\n    \"title\": \"Brace yourselves, Exorde is coming.\",\n    \"products\": [{\n      \"title\": \"Exorde shield\",\n      \"description\": \"A free open-source browser extension that displays a trust score for every information you encounter on the Internet.\",\n      \"image\": \"../images/shield.svg\"\n    }, {\n      \"title\": \"Exorde power\",\n      \"description\": \"A free open-source collaborative platform where you do some tasks, and you receive payment in exchange for your efforts.\",\n      \"image\": \"../images/thunderbolt.svg\"\n    }]\n  },\n  \"concept\": {\n    \"title\": \"Understand Exorde in a minute.\",\n    \"steps\": [{\n      \"description\": \"It's difficult, when surfing the internet, to know if what we read is reliable. Exorde aims to help you navigate serenely.\",\n      \"image\": \"../images/exorde-context.svg\"\n    }, {\n      \"description\": \"The Exorde platform will gather a whole community that will browse the web and its information. Accessible for free by everyone through a website, you will just have to create an account to access it. You will then have different tasks to perform to find, classify and link information on the web and allow the Exorde system to detect fake news.\",\n      \"image\": \"../images/exorde-platform.svg\"\n    }, {\n      \"description\": \"For each contribution and when there is a consensus between the different collaborators, you will earn EXD, the cryptocurrency of Exorde. You will then be able to exchange it for euros, dollars, ethereum, bitcoin, etc.\",\n      \"image\": \"../images/exorde-money.svg\"\n    }, {\n      \"description\": \"The information entered on the platform will then be found on APIs dedicated to developers and on the Exorde browser extension. Accessible without registration, this extension will allow you to display a reliability indicator on the page you visit and will indicate other sites that contain similar information.\",\n      \"image\": \"../images/exorde-extension.svg\"\n    }]\n  },\n  \"whitepaper\": {\n    \"title\": \"Whitepaper\",\n    \"description\": \"Exorde is a complex system, so we could only approach it in a macroscopic way on this website. This whitepaper, result of long reflections within our team, is therefore intended for the most curious. You will find detailed explanations of what Exorde is and how, with your help, we will change the internet.\",\n    \"file\": \"../pdf/whitepaper.pdf\",\n    \"pdfButton\": {\n      \"label\": \"Pdf version\"\n    }\n  },\n  \"newsletter\": {\n    \"title\": \"Newsletter\",\n    \"description\": \"Do you want to follow the progress of the Exorde project? Enter your first name, your email and let's go ðŸš€.\",\n    \"form\": {\n      \"firstNameLabel\": \"First name\",\n      \"emailLabel\": \"Email\",\n      \"buttonLabel\": \"Suscribe\",\n      \"successLabel\": \"Sent\",\n      \"successMessage\": \"Thanks for your subscription ! You will receive an email from us to confirm your address, please check your spam if it does not appear in your inbox.\"\n    }\n  }\n};\nvar layoutProps = {\n  data: data,\n  _frontmatter: _frontmatter\n};\nvar MDXLayout = \"wrapper\";\nreturn function MDXContent(_ref) {\n  var components = _ref.components,\n      props = _objectWithoutProperties(_ref, [\"components\"]);\n\n  return mdx(MDXLayout, _extends({}, layoutProps, props, {\n    components: components,\n    mdxType: \"MDXLayout\"\n  }), mdx(Hero, {\n    content: props.frontmatter.hero,\n    mdxType: \"Hero\"\n  }), mdx(Enemy, {\n    content: props.frontmatter.video,\n    mdxType: \"Enemy\"\n  }, mdx(\"p\", null, \"In recent years, a great deal of attention has been devoted to the rise in fake news: everything from satire and misleading content to articles that are completely fabricated.\\nWhen any type of content (image, news, video, audio, \\u2026) makes it on the web, it can spread anywhere in a matter of seconds, without any original context, for any purpose.\"), mdx(\"p\", null, \"Any authentic content (or not) can be reused to create viral fake information to manipulate the public opinion on a given subject in the short term or hurt the reputation of any entity (organizations, personas, etc).\")), mdx(Concept, {\n    title: props.frontmatter.concept.title,\n    steps: props.frontmatter.concept.steps,\n    mdxType: \"Concept\"\n  }), mdx(Products, {\n    title: props.frontmatter.showcase.title,\n    products: props.frontmatter.showcase.products,\n    mdxType: \"Products\"\n  }), mdx(Whitepaper, {\n    title: props.frontmatter.whitepaper.title,\n    description: props.frontmatter.whitepaper.description,\n    file: props.frontmatter.whitepaper.file,\n    pdfButton: props.frontmatter.whitepaper.pdfButton,\n    mdxType: \"Whitepaper\"\n  }), mdx(Newsletter, {\n    title: props.frontmatter.newsletter.title,\n    description: props.frontmatter.newsletter.description,\n    form: props.frontmatter.newsletter.form,\n    locale: props.locale,\n    mdxType: \"Newsletter\"\n  }));\n}\n;\nMDXContent.isMDXComponent = true;","frontmatter":{"noindex":null,"metadata":{"title":"The Internet needs superheroes.","description":"Exorde is the place where people fight against online misinformation.","image":{"publicURL":"/static/5d7f8034e7605e31ce38010f8e498085/hero.png"},"canonical":true},"hero":{"title":"The Internet needs superheroes.","description":"Exorde is the place where people fight against online misinformation.","whitepaperButton":"Whitepaper","waitlistButton":"Suscribe"},"video":{"title":"Our enemy ? Fake news propagation.","description":"In recent years, a great deal of attention has been devoted to the rise in fake news: everything from satire and misleading content to articles that are completely fabricated. When any type of content (image, news, video, audio, â€¦) makes it on the web, it can spread anywhere in a matter of seconds, without any original context, for any purpose. Any authentic content (or not) can be reused to create viral fake information to manipulate the public opinion on a given subject in the short term or hurt the reputation of any entity (organizations, personas, etc).","url":"https://www.youtube-nocookie.com/embed/cSKGa_7XJkg?controls=0&autoplay=1","thumbnail":"https://i.ytimg.com/vi_webp/cSKGa_7XJkg/maxresdefault.webp"},"showcase":{"title":"Brace yourselves, Exorde is coming.","products":[{"title":"Exorde shield","description":"A free open-source browser extension that displays a trust score for every information you encounter on the Internet.","image":{"publicURL":"/static/f95a2e57386be32ae10f459cee7dd0df/shield.svg"}},{"title":"Exorde power","description":"A free open-source collaborative platform where you do some tasks, and you receive payment in exchange for your efforts.","image":{"publicURL":"/static/9dd4f09accbbb6bf80598ce1279977c8/thunderbolt.svg"}}]},"concept":{"title":"Understand Exorde in a minute.","steps":[{"description":"It's difficult, when surfing the internet, to know if what we read is reliable. Exorde aims to help you navigate serenely.","image":{"publicURL":"/static/2f5225f1ecf2ddf8d73bb7c22337de56/exorde-context.svg","name":"exorde-context"}},{"description":"The Exorde platform will gather a whole community that will browse the web and its information. Accessible for free by everyone through a website, you will just have to create an account to access it. You will then have different tasks to perform to find, classify and link information on the web and allow the Exorde system to detect fake news.","image":{"publicURL":"/static/e4433ba86e5eaed0975a3806b243ddd2/exorde-platform.svg","name":"exorde-platform"}},{"description":"For each contribution and when there is a consensus between the different collaborators, you will earn EXD, the cryptocurrency of Exorde. You will then be able to exchange it for euros, dollars, ethereum, bitcoin, etc.","image":{"publicURL":"/static/8307cbac64566b8303b8ce0cf6e5e7f1/exorde-money.svg","name":"exorde-money"}},{"description":"The information entered on the platform will then be found on APIs dedicated to developers and on the Exorde browser extension. Accessible without registration, this extension will allow you to display a reliability indicator on the page you visit and will indicate other sites that contain similar information.","image":{"publicURL":"/static/1ea828e927e5cda99241dfe891e6bb0f/exorde-extension.svg","name":"exorde-extension"}}]},"whitepaper":{"title":"Whitepaper","description":"Exorde is a complex system, so we could only approach it in a macroscopic way on this website. This whitepaper, result of long reflections within our team, is therefore intended for the most curious. You will find detailed explanations of what Exorde is and how, with your help, we will change the internet.","file":{"publicURL":"/static/76aaa000ae9d652a192fd6d843215227/whitepaper.pdf"},"pdfButton":{"label":"Pdf version"}},"newsletter":{"title":"Newsletter","description":"Do you want to follow the progress of the Exorde project? Enter your first name, your email and let's go ðŸš€.","form":{"firstNameLabel":"First name","emailLabel":"Email","buttonLabel":"Suscribe","successLabel":"Sent","successMessage":"Thanks for your subscription ! You will receive an email from us to confirm your address, please check your spam if it does not appear in your inbox."},"success":null}}}},"pageContext":{"id":"63bbc44f-caf4-532a-b433-11c38f40d022","locale":"en","alternatePages":[{"slug":"/","locale":"en"},{"slug":"/fr","locale":"fr"}]}},"staticQueryHashes":["3897982121"]}